{
  "ci_release_files": [
    "scripts/release.sh"
  ],
  "doc_files": [
    "README.md",
    "scripts/README.md"
  ],
  "docs_roots": [
    ".",
    "scripts"
  ],
  "files": [
    {
      "mode": "100644",
      "object_id": "832e80a1a8499854fee0b1bcbd14100f61672773",
      "object_type": "blob",
      "path": ".gitignore",
      "size": null
    },
    {
      "mode": "100644",
      "object_id": "6946d44198d54bf700ad1e1b456301c15b9bce49",
      "object_type": "blob",
      "path": "AGENTS.md",
      "size": null
    },
    {
      "mode": "120000",
      "object_id": "47dc3e3d863cfb5727b87d785d09abf9743c0a72",
      "object_type": "blob",
      "path": "CLAUDE.md",
      "size": null
    },
    {
      "mode": "100644",
      "object_id": "14b9c4b398c65006e0d6964296fff4ee84b447c1",
      "object_type": "blob",
      "path": "LICENSE",
      "size": null
    },
    {
      "mode": "100644",
      "object_id": "5ea1fbab8b7bb6404fc37ffd04bda633750e2aed",
      "object_type": "blob",
      "path": "README.md",
      "size": null
    },
    {
      "mode": "100644",
      "object_id": "60471425f0926b51d4430edaddb33ad013275d8a",
      "object_type": "blob",
      "path": "appcast.xml",
      "size": null
    },
    {
      "mode": "100644",
      "object_id": "55fe6b7d1d7d70a98b156c649f3103151bc3582d",
      "object_type": "blob",
      "path": "clicky-demo.gif",
      "size": null
    },
    {
      "mode": "100644",
      "object_id": "8a6af5171608513e1b23a0f8fe95990d50054a9c",
      "object_type": "blob",
      "path": "dmg-background.png",
      "size": null
    },
    {
      "mode": "100644",
      "object_id": "75e572618a820ab2af615e9dc75b60b8e185e306",
      "object_type": "blob",
      "path": "leanring-buddy.xcodeproj/project.pbxproj",
      "size": null
    },
    {
      "mode": "100644",
      "object_id": "919434a6254f0e9651f402737811be6634a03e9c",
      "object_type": "blob",
      "path": "leanring-buddy.xcodeproj/project.xcworkspace/contents.xcworkspacedata",
      "size": null
    },
    {
      "mode": "100644",
      "object_id": "d88adb2160e68c1e772f8996ac525383b6d24bbd",
      "object_type": "blob",
      "path": "leanring-buddy.xcodeproj/project.xcworkspace/xcshareddata/swiftpm/Package.resolved",
      "size": null
    },
    {
      "mode": "100644",
      "object_id": "6c13490a04b0bcfccf3b46cecabec279ffd315e5",
      "object_type": "blob",
      "path": "leanring-buddy.xcodeproj/xcuserdata/julianalvarez.xcuserdatad/xcschemes/xcschememanagement.plist",
      "size": null
    },
    {
      "mode": "100644",
      "object_id": "6c13490a04b0bcfccf3b46cecabec279ffd315e5",
      "object_type": "blob",
      "path": "leanring-buddy.xcodeproj/xcuserdata/thorfinn.xcuserdatad/xcschemes/xcschememanagement.plist",
      "size": null
    },
    {
      "mode": "100644",
      "object_id": "b59cb0919ec5e08def717ba598e2296d8181179f",
      "object_type": "blob",
      "path": "leanring-buddy/AGENTS.md",
      "size": null
    },
    {
      "mode": "100644",
      "object_id": "6fd23375773761d3f711c87e3af9ad561786812d",
      "object_type": "blob",
      "path": "leanring-buddy/AppBundleConfiguration.swift",
      "size": null
    },
    {
      "mode": "100644",
      "object_id": "600594fabc2cd600fd2979be8d3abe5699cf4607",
      "object_type": "blob",
      "path": "leanring-buddy/AppleSpeechTranscriptionProvider.swift",
      "size": null
    },
    {
      "mode": "100644",
      "object_id": "d21286b6596e9141c5549e1b09c4c35521c97d28",
      "object_type": "blob",
      "path": "leanring-buddy/AssemblyAIStreamingTranscriptionProvider.swift",
      "size": null
    },
    {
      "mode": "100644",
      "object_id": "eb8789700816459c1e1480e0b34781d9fb78a1ca",
      "object_type": "blob",
      "path": "leanring-buddy/Assets.xcassets/AccentColor.colorset/Contents.json",
      "size": null
    },
    {
      "mode": "100644",
      "object_id": "037d7ca027142eb9026b4aeaa13798e771b63bb8",
      "object_type": "blob",
      "path": "leanring-buddy/Assets.xcassets/AppIcon.appiconset/1024-mac.png",
      "size": null
    },
    {
      "mode": "100644",
      "object_id": "c056299b2a23c939fc12208b3c1bdaa40d14bdd8",
      "object_type": "blob",
      "path": "leanring-buddy/Assets.xcassets/AppIcon.appiconset/128-mac.png",
      "size": null
    },
    {
      "mode": "100644",
      "object_id": "c6dcb7700545a31f0d64372dd783328c7c737ab1",
      "object_type": "blob",
      "path": "leanring-buddy/Assets.xcassets/AppIcon.appiconset/16-mac.png",
      "size": null
    },
    {
      "mode": "100644",
      "object_id": "cbae9774fbca28aafce5e588700c52f37ba4cdea",
      "object_type": "blob",
      "path": "leanring-buddy/Assets.xcassets/AppIcon.appiconset/256-mac.png",
      "size": null
    },
    {
      "mode": "100644",
      "object_id": "a5088ec496f327d1ad59cc29c8744443e7b450c0",
      "object_type": "blob",
      "path": "leanring-buddy/Assets.xcassets/AppIcon.appiconset/32-mac.png",
      "size": null
    },
    {
      "mode": "100644",
      "object_id": "1ca5e44611efaebd886088fd88515fe25cb00536",
      "object_type": "blob",
      "path": "leanring-buddy/Assets.xcassets/AppIcon.appiconset/512-mac.png",
      "size": null
    },
    {
      "mode": "100644",
      "object_id": "ef90c27e95ff781ceab4f6bac2b327b7112177f8",
      "object_type": "blob",
      "path": "leanring-buddy/Assets.xcassets/AppIcon.appiconset/64-mac.png",
      "size": null
    },
    {
      "mode": "100644",
      "object_id": "5177872aa892ee9bb99f7ec11c9cffedba7bead5",
      "object_type": "blob",
      "path": "leanring-buddy/Assets.xcassets/AppIcon.appiconset/Contents.json",
      "size": null
    },
    {
      "mode": "100644",
      "object_id": "73c00596a7fca3f3d4bdd64053b69d86745f9e10",
      "object_type": "blob",
      "path": "leanring-buddy/Assets.xcassets/Contents.json",
      "size": null
    },
    {
      "mode": "100644",
      "object_id": "17f6fd9482f72ee77e75819da9623db0840783db",
      "object_type": "blob",
      "path": "leanring-buddy/Assets.xcassets/add-a-project-in-codex-from-sidebar.imageset/Contents.json",
      "size": null
    },
    {
      "mode": "100644",
      "object_id": "4584882a7befe1939ad3365ded29ff7298deea45",
      "object_type": "blob",
      "path": "leanring-buddy/Assets.xcassets/add-a-project-in-codex-from-sidebar.imageset/Image.png",
      "size": null
    },
    {
      "mode": "100644",
      "object_id": "93ca50fa66fb4b1f7a92f242bb62bc10039dc3b3",
      "object_type": "blob",
      "path": "leanring-buddy/Assets.xcassets/add-a-project-in-codex.imageset/Contents.json",
      "size": null
    },
    {
      "mode": "100644",
      "object_id": "68847ce79b97523ca37787b448b1a907492c1129",
      "object_type": "blob",
      "path": "leanring-buddy/Assets.xcassets/add-a-project-in-codex.imageset/add-a-project-in-codex.png",
      "size": null
    },
    {
      "mode": "100644",
      "object_id": "37b9955ff499fa98248b7e38bb9f21e72084659c",
      "object_type": "blob",
      "path": "leanring-buddy/Assets.xcassets/codex-app-screenshot.imageset/Contents.json",
      "size": null
    },
    {
      "mode": "100644",
      "object_id": "47548b9a16fb8957a69e0752951f1a7e20e5d2f9",
      "object_type": "blob",
      "path": "leanring-buddy/Assets.xcassets/codex-app-screenshot.imageset/codex-app-screenshot.jpg",
      "size": null
    },
    {
      "mode": "100644",
      "object_id": "8b73e30b47ec27299be891602c8f849ba46a922e",
      "object_type": "blob",
      "path": "leanring-buddy/Assets.xcassets/codex-home-screen.imageset/Contents.json",
      "size": null
    },
    {
      "mode": "100644",
      "object_id": "02e74f1f2d9eb33aeee7874264320f1c1a4b090c",
      "object_type": "blob",
      "path": "leanring-buddy/Assets.xcassets/codex-home-screen.imageset/codex-home-screen.png",
      "size": null
    },
    {
      "mode": "100644",
      "object_id": "5ca6299247a9c71be9996d56c2a451b41d91e8f0",
      "object_type": "blob",
      "path": "leanring-buddy/Assets.xcassets/codex-permissions.imageset/Contents.json",
      "size": null
    },
    {
      "mode": "100644",
      "object_id": "308b542a82849bf418f7cc4eb423cad1c3b6d88f",
      "object_type": "blob",
      "path": "leanring-buddy/Assets.xcassets/codex-permissions.imageset/codex-permissions.png",
      "size": null
    },
    {
      "mode": "100644",
      "object_id": "65d8ed3e8eea9ab71718236e631ae122f630db8c",
      "object_type": "blob",
      "path": "leanring-buddy/Assets.xcassets/discord-logo.imageset/Contents.json",
      "size": null
    },
    {
      "mode": "100644",
      "object_id": "f059720929611ba610c15113d3487f90c68900cd",
      "object_type": "blob",
      "path": "leanring-buddy/Assets.xcassets/discord-logo.imageset/discord-logo.svg",
      "size": null
    },
    {
      "mode": "100644",
      "object_id": "43657ae01064cc246176a5719acd8a9818162f4f",
      "object_type": "blob",
      "path": "leanring-buddy/Assets.xcassets/git-tools-prompt.imageset/Contents.json",
      "size": null
    },
    {
      "mode": "100644",
      "object_id": "f4aa6e495883777c147cae303a55b628b22ce985",
      "object_type": "blob",
      "path": "leanring-buddy/Assets.xcassets/git-tools-prompt.imageset/git-tools-prompt.png",
      "size": null
    },
    {
      "mode": "100644",
      "object_id": "9ce91aa3f27b870e01f336d2d8c65c2920bbd2c7",
      "object_type": "blob",
      "path": "leanring-buddy/Assets.xcassets/google-logo.imageset/Contents.json",
      "size": null
    },
    {
      "mode": "100644",
      "object_id": "e102c9d655eca16612af8bc1b900c374511cf66a",
      "object_type": "blob",
      "path": "leanring-buddy/Assets.xcassets/google-logo.imageset/google-logo.svg",
      "size": null
    },
    {
      "mode": "100644",
      "object_id": "5d0d423e5f3b3a16cff8397afde088679a7e7184",
      "object_type": "blob",